recipedetails,Audio,Image,Video,Text,other
pre heat oven 375 degre f toss potato sweet potato ½ tablespoon oliv oil season salt pepper garlic powder chili powder put bake tray cook oven 15 minut stir everi 5 minut add zucchini mushroom mix anoth ½ tablespoon oliv oil mix well potato sweet potato roast anoth 5 10 minut make sure veggi nice caramel take roast veggi plate finish 2 egg prepar way like,0,1,0,0,0
spong method separ yolk white clean beater whip white 1 2 cup sugar firm keep asid add remain sugar yolk beat tripl volum sugar ha dissolv yolk pale creami 8 10 minut add 1 3 beaten egg white fold gentli releas ani beaten air sift half flour fold gentli follow 1 3 beaten white remain flour final remain beaten white gentli turn prepar tin bake 180c 25 30 minut tester come clean remov tin immedi peel parchment cool complet rack bavarian cream method whisk egg yolk balloon whisk 1 3 cup vanilla sugar smooth simmer 1 2 cup milk 200ml cream 1 scrape vanilla bean bean includ turn heat allow infus 30 minut bloom gelatin 3 tbsp cold milk put pan back simmer onc milk mixtur come boil take heat whisk yolk mix somewhat like french pastri cream return heavi bottom pan place medium heat custard thicken coat back spoon stir constantli take whisk bloom gelatin strain leav cool quicken cool stir bowl held bowl ice onc complet cool whip 200ml cream 1 2 tbsp castor sugar 1 tsp vanilla extract fold custard gentli thoroughli notic bavarian thicken custard cool slice spong two gentli paint sugar syrup littl lime juic ad thi moisten spong bit place lower layer serv platter within cake dessert ring arrang chop strawberri cover cool bavarian cream held within mold place top layer gentli push cream level cling wrap entir thing chill 8 hour prefer overnight bavarian set,0,1,0,0,0
spanish gazpacho soup place ingredi blender vitamix blend well smooth 3 minut refriger 1 2 hour befor serv garnish organ crunchi onion chop parsley dri prepar chees toast broil chees toast,0,1,0,0,0
heat oven 350 degre f greas 2 loaf pan 9x5x3 mix flour bake soda salt bake powder cinnamon clove cream shorten sugar thoroughli add egg pumpkin water add dri ingredi gradual mix well stir pecan,0,1,0,0,0
turn oven 200 c two cocottin line parchment paper divid circl puff pastri lay crescent cocottin obtain tri form basket leav contain part sheet form crunchi bit prick bottom pastri fork cover insid basket bake paper fill ceram weight dri chickpea bake 10 minut remov wax paper weight bake 6 minut meanwhil chop walnut leav herb bring boil salt water cook tortellini 5 minut larg fri pan gentli heat butter add chop nut herb cook minut add cream heat low heat coupl minut drain tortellini toss pan walnut sauc place basket pasta individu dish fill tortellini walnut sauc fresh herb,0,1,1,0,0
mix warm milk sugar yeast small bowl yeast dissolv set asid blend flour bake powder salt lemon zest larg bowl electr mixer add butter blend mixtur crumbl beat egg egg yolk vanilla small bowl add flour mixtur altern milk mixtur blend dough come togeth transfer dough flour board divid dough 4 part knead part flat disc wrap plastic wrap refriger 1 hour spoon poppi seed fill pastri bag blend sugar nut small bowl set asid roll disc dough thin sheet larg enough fit 13 9 inch bake dish trim sheet dough fit dish reserv trim poppi seed strudel desir arrang 1 sheet dough bottom bake dish pipe half fill onto pastri spread use spoon spread poppi seed fill evenli sheet dough cover second sheet dough sprinkl 1 cup walnut fill arrang sheet dough top repeat layer poppi seed fill top remain sheet dough cover kitchen towel let stand 30 minut,1,0,0,0,0
mix ingredi togeth bowl,0,1,0,0,0
medium mix bowl cream butter sugar well add egg yolk sour cream mix medium bowl sift flour bake soda cinnamon nutmeg set asid 2 tablespoon dri ingredi toss blueberri stir dri ingredi cream mixtur wash drain pat dri flour blueberri fold batter beat egg white gentli fold egg batter spoon paper line greas flour muffin tin sprinkl brown sugar muffin bake 375 degre 20 25 minut,1,0,0,0,0
fill combin saucepan abov ingredi allow mixtur simmer low thicken crust preheat oven 350 degre cut butter dri ingredi work finger incorpor make well center add milk combin dough milk use hand stir loosen side,0,0,1,0,0
greas 10 inch springform pan line bake paper prepar curst combin siev first five ingredi first bowl cut butter egg smooth dough form press firmli bottom side prepar pan use fork prick crust regular interv cover chill crust 30 minut pre heat oven 200c 400f stir chop chocol sugar heatproof bowl set pan simmer water melt smooth remov bowl water stir vanilla extract let cool briefli lukewarm still pourabl blend quark cream chees anoth bowl smooth add cocoa powder pud powder stir combin blend egg one time gentli stir lukewarm chocol complet blend pour fill crust press cherri lightli chocol mixtur use bake fill set 50 minut turn oven let cool oven door ajar 1 hour take cool complet chill cake overnight,0,1,1,0,0
place ingredi broth larg stock pot bring boil lower heat simmer cover cook 30 60 minut longer broth simmer flavor time pinch 30 minut simmer still make delici pho,0,0,1,1,0
pan pour two inch oil heat medium heat till hot cut chicken diagon thick strip two inch wide bowl beat egg anoth contain place flour coat chicken strip egg mixtur first gener pat flour cover side often give coupl coat thick layer batter chicken piec oil hot fri chicken piec till golden brown 3 minut side remov chicken let rest paper towel drain oil make candi sauc place soy sauc sugar bowl mix togeth 30 second sugar complet dissolv mixtur thick graini,0,1,0,0,0
thi recip appear cookbook live russian far east near china love cook thi salad day day basi dinner parti serv salad puff pastri basket ingredi thi salad simpl may found everi pantri wash boil carrot separ pot wash boil rice separ pot boil egg hard boil rice ha boil soft cook carrot ha cook overcook rice cook drain rins cold water egg cook 6 8 min put cold water cool carrot drain let cool peel fine chop onion 1 2 drain rins corn 3 4 cup peel fine chop carrot rice cool mix carrot onion corn shell chop egg wash chop dill,0,1,0,0,0
spong method separ yolk white clean beater whip white 1 2 cup sugar firm keep asid add remain sugar yolk beat tripl volum sugar ha dissolv yolk pale creami 8 10 minut add 1 3 beaten egg white fold gentli releas ani beaten air sift half flour fold gentli follow 1 3 beaten white remain flour final remain beaten white gentli turn prepar tin bake 180c 25 30 minut tester come clean remov tin immedi peel parchment cool complet rack,0,1,0,0,0
cost prepar time 25 minut,1,0,0,1,0
small bowl place tomato lemon juic parsley basil green onion oliv oil salt pepper mix well let rest slightli cover bottom larg skillet salt place high heat hot add steak sear desir done 5 minut per side medium rare place steak plate serv tomato salad side pour juic steak,1,0,0,0,0
step 1 bowl add paneer cube corn flour mix well step 2 heat oil pan deep fri paneer crisp golden brown remov absorb paper soak extra oil keep asid step 3 heat 2 tbsp oil pan add dri red chilli garlic ginger green chili sauté time step 4 add onion capsicum sauté well step 5 add ching secret schezwan chutney toss well,0,0,0,1,0
medium mix bowl cream butter sugar well add egg yolk sour cream mix medium bowl sift flour bake soda cinnamon nutmeg set asid 2 tablespoon dri ingredi toss blueberri stir dri ingredi cream mixtur,1,0,0,0,0
dough mix flour sooji salt oil togeth make smooth dough knead dough 4 5 min make smooth set dough asid cover plastic food wrap let dough sit 20 25 min fill boil potato pressur cooker 2 whistl let cool remov skin mash well heat oil add mustard seed urad dal onion fri till onion turn light brown color,0,0,1,0,0
fill larg pot water bring boil high heat liber salt water add pasta cook accord packag direct al dent drain toss 2 tbsp oliv oil set asid larg skillet heat rest oliv oil medium heat add mushroom red pepper rosemari sauté tender,1,0,1,1,0
larg pot heat oil medium heat saut onion tender 8 minut add carrot continu cook anoth 5 minut season salt pepper garlic red pepper flake cook anoth minut remov sausag case break small chunk pot,0,1,1,0,0
grate carrot zucchini drain excess water combin beef minc ingredi mix well hand form meatbal ani size want,1,0,0,0,0
fill larg pot water bring boil high heat liber salt water add pasta,1,0,0,0,0
bring 1 2 litr water boil saucepan use small endo thermal magic cooker add drain white wheat let simmer 7 10 minut remov pot stove place magic cooker cover let wheat continu cook use heat pot,1,0,1,0,0
steam bean crisp tender cool toss remain ingredi,0,1,0,0,0
chop bacon 1 2 inch piec sauté hot larg pan fat ha liquifi may add littl oliv oil like add dice onion cook onion start brown add ground meat cook meat ha turn pink left add season garlic stir mix put larg bowl allow cool room temp littl warmer make pie crust line bottom deep dish 9 10 inch pie plate dough,0,0,1,0,0
larg heavi saucepan heat 1 4 cup oil saut fine ground meat onion veri fine chop crush garlic lightli brown add crush oregano crush basil cinnamon salt ripe oliv tomato sauc cover simmer slowli 30 minut uncov simmer slowli anoth 30 minut sauc simmer prepar bechamel sauc recip eggplant cut end eggplant 1 larg 2 small cut 1 2 inch thick slice use larg flask type eggplant peel skin strip veget peeler creat stripe look peel left use japanes style longish purpli white one bother peel place cooki sheet brush remain oliv oil place broiler broil light brown remov oven salt lightli turn eggplant repeat pr,0,0,0,1,0
preheat oven 400 degre,0,0,1,0,0
saut onion green pepper bacon mushroom oil dutch oven 4 minut add slice potato slice carrot cook anoth 4 minut add rest ingredi cook slowli 1 1 2 hour potato nice soft make sure stir everi 15 minut,0,1,1,0,0
bowl mix chocol cooki crust ingredi togeth well combin help mix ingredi hand mini cupcak pan place mini cupcak liner insid press chocol crust bottom liner place cooki crust freezer make banana ice cream place banana ice cream ingredi blender wait 8 10 unthaw bit blend ingredi reach creami ice cream consist,1,0,1,0,0
mix ingredi togeth let mixtur rest 10 minut loaf pan befor bake larg loaf pan bake 350 70 minut 2 small loaf pan 350 45 minut,0,0,0,1,0
pour tea ale larg bowl stir sugar add fruit leav fridg overnight readi bake preheat 350 degre f add beaten egg soak fruit sift self rise flour mix spice mix thoroughli,0,1,0,0,0
melt chocol top doubl boiler microwav stir peanut butter place peanut wide shallow dish roll 3 4 piec banana melt chocol peanut butter mixtur stir coat remov banana use fork place dish contain peanut roll chocol cover banana peanut coat best onc well coat place banana bake sheet line wax paper repeat remain banana melt chocol mixtur need onc complet place freezer onc frozen store freezer bag airtight contain thaw 8 10 minut befor eat ensur banana bite frozen rock hard,1,0,1,1,0
greas 10 inch springform pan line bake paper prepar curst combin siev first five ingredi first bowl cut butter egg smooth dough form press firmli bottom side prepar pan use fork prick crust regular interv cover chill crust 30 minut pre heat oven 200c 400f stir chop chocol sugar heatproof bowl set pan simmer water melt smooth remov bowl water stir vanilla extract let cool briefli lukewarm still pourabl blend quark cream chees anoth bowl smooth add cocoa powder pud powder stir combin blend egg one time gentli stir lukewarm chocol complet blend pour fill crust press cherri lightli chocol mixtur use bake fill set 50 minut turn oven let cool oven door ajar 1 hour take cool complet chill cake overnight pot combin sugar cornstarch add cherri lemon juic stir smooth cook medium heat stir mixtur boil thicken remov heat let cool drizzl chocol cheesecak cherri sauc simpli dust ice sugar,0,1,0,0,0
spread frozen wing shallow pan one layer bake 450 degre 30 minut 45 minut larg quantiti place one sauc toss coat thoroughli 1 butter durke hot sauc mix ha post coupl time anchor bar origin way 2 2 part durke redhot sauc 1 part lemon juic salad oil one quart durke 1 pint lemon juic salad oil 4 tsp dri basil 2 tsp powder onion 1 tsp powder garlic dip cook wing immedi sauc 3 sweet sour apricot sauc blend 1 2 cup apricot preserv 1 4 cup russian dress 1 tbsp water 1 1 2 tsp dri onion soup mix 3 4 cup toss cook wing immedi gener tip allow 3 4 cup sauc 24 wing portion use 9x13x2 pan 24 wing,1,0,0,0,0
make fill drain two tuna heat oil skillet fri pan add crush ginger garlic stir add onion green chili curri leav cinnamon cook onion tender light brown add drain tuna stir togeth allow cook minut add drain tuna liquid stir allow cook liquid dri add salt pepper cardamom powder stir well mix add potato mix well cook mixtur well cook turn heat let mixtur cool make fish bun larg bowl combin warm water yeast salt oil sugar 4 cup flour mix thoroughli let spong rise doubl size gradual add 4 cup flour knead smooth place dough greas bowl turn sever time coat cover damp cloth allow rise doubl punch dough let rest minut devid roll 30 35 spread roll flour board add littl tuna mix center fold dough shape roll place greas cooki sheet cover wet tea towel allow rise 15 minut,0,1,1,0,0
instruct rins drain chickpea dice onion pepper heat oil wok sweat onion season salt 5 minut add spice blend reduc heat slightli cook 5 minut,0,0,0,1,0
preheat oven 400f degre slice carrot bia 1 4 inch thick toss oliv oil salt tast place larg roast pan carrot one singl layer add citru juic cover tightli foil place center rack oven bake 10 minut remov oven remov foil drizzl honey toss carrot coat evenli return uncov oven rais temperatur 450f,0,1,0,0,0
preheat grill medium high flame brush grill canola oil,0,0,0,1,0
put togeth meat grinder attach sausag stuffer piec insert head mixer tighten well,0,0,1,0,0
preheat oven 200 degre c whisk togeth melt butter sugar add one egg time mix well batter turn fluffi mix togeth bowl flour bake powder ginger powder cinnamon mash banana add coffe blend add flour mix banana coffe mix egg sugar butter mix blend care blend much hard thi make muffin dens prefer fluffi divid batter among muffin cup three fourth full bake puf golden brown insert wooden pick skewer center muffin come clean muffin readi take 20 30 minut muffin great eat day even better moist day alway eat first day next day mean resist freshli bake muffin,1,1,0,0,0
mix ingredi,0,0,0,1,0
cake preheat oven 350f butter 9 inch cake pan bowl sift togeth flour bake powder salt whisk togeth cream butter 3 4 cup sugar mixer heavi wooden spoon whisk egg yolk milk vanilla extract mixtur smooth whisk flour mixtur 1 2 cup time overwork beat egg white cream tartar 2 minut soft peak add remain 3 tbsp sugar beat medium peak whisk one forth egg mixtur butter mixtur lighten fold rest egg white mixtur rubber spatula spread batter cake pan bake 40 50 minut toothpick insert center come clean let cool 5 minut cake pan transfer cool rack cool complet cake room temperatur insert 4 toothpick 4 side cake mark middl long bread knife cut cake 2 halv lengthwis along toothpick,0,1,0,0,0
mexican lettuc wrap make taco season stir ingredi bowl well combin,1,0,1,0,0
melt chocol top doubl boiler veri low heat chocol ha melt whisk 1 25 cup sugar mix well sugar ha dissolv whisk butter melt stir often butter complet incorpor remov mixtur fire whisk grand marnier,0,1,0,0,0
fold marshmallow whip top set asid bring 2 cup water boil dissolv lime lemon gelatin separ 1 cup water,0,0,1,0,0
10 12 inch fri pan combin onion butter margarin sugar stir often medium high heat onion limp lightli brown 12 15 minut add flour mix well remov pan heat stir milk beef broth stir high heat boil continu stir liquid almost evapor mixtur doe flow scrape pan bottom 4 5 minut remov heat,1,0,1,1,0
mix ingredi togeth bowl add small amount water knead stiff dough roll small portion dough paratha shape cook paratha flat pan side golden brown colour,0,1,0,0,0
cake preheat oven 350f butter 9 inch cake pan bowl sift togeth flour bake powder salt whisk togeth cream butter 3 4 cup sugar mixer heavi wooden spoon whisk egg yolk milk vanilla extract mixtur smooth whisk flour mixtur 1 2 cup time overwork beat egg white cream tartar 2 minut soft peak add remain 3 tbsp sugar beat medium peak whisk one forth egg mixtur butter mixtur lighten fold rest egg white mixtur rubber spatula spread batter cake pan bake 40 50 minut toothpick insert center come clean let cool 5 minut cake pan transfer cool rack cool complet cake room temperatur insert 4 toothpick 4 side cake mark middl long bread knife cut cake 2 halv lengthwis along toothpick syrup mix sugar water brandi thoroughli sugar dissolv place fridg cake readi assembl coffe mouss readi use pastri brush spread syrup 2 halv let soak 3 5 minut befor ad mouss mouss,0,1,0,0,0
1 heat oil pressur cooker 2 fri ginger garlic past onion green chilli 3 add mutton cook 4 add dri spice bay leav keep saut,0,0,0,1,0
step 1 bowl add paneer cube corn flour mix well step 2 heat oil pan deep fri paneer crisp golden brown remov absorb paper soak extra oil keep asid step 3,0,0,0,1,0
make fill drain two tuna,0,1,0,1,0
put ingredi medium size bowl mix well wooden spoon evenli mix pour 9 x 13 inch pan spread evenli bake 350 degre 30 40 minut remov oven pour 1 cup chocol chip top let stand 5 minut spread chocol chip evenli browni let cool complet befor cut,0,0,1,0,0
slice link sausag cook skillet brown stir frequent add egg stir constantli,0,0,1,0,0
start make dough ravioli add food processor ravioli ingredi run processor mix ingredi well dough look like pebbl touch dri add 1 2 1 tsp water mix form nice ball dough onc dough mix bring processor knead minut cover ball pasta dough plastic wrap let rest good twenti minut dough rest let whip tasti fill grab skillet heat butter medium heat add garlic,0,0,0,1,0
soak raw chickpea 2 cup water least 6 hour drain rins well lay chickpea paper towel pat dri kitchen towel paper towel preheat oven 400 f transfer chickpea bake dish add 1 tb canola oil bake dish mix chickpea evenli coat oil bake 35 40 minut chickpea golden brown let cool bake sheet 10 minut befor transfer contain mini grinder grind mix salt spice sprinkl ¼ tsp spice salt mixtur roast chickpea set asid chickpea roast oven cook quinoa follow packag instruct approxim 15 minut,1,0,1,1,0
melt chocol top doubl boiler veri low heat chocol ha melt whisk 1 25 cup sugar mix well sugar ha dissolv whisk butter melt stir often butter complet incorpor remov mixtur fire whisk grand marnier whip egg yolk mix bowl light fluffi slowli add chocol mixtur egg yolk whip constantli fulli incorpor set asid whip egg white anoth mix bowl foami add remain 25 cup sugar continu whip stiff,0,1,0,0,0
mix bowl cream butter sugar add egg mix well add milk sweet potato vanilla cinnamon nutmeg salt mix well smooth pour pie shell bake 425 degre 15 minut,0,1,0,0,0
spong method separ yolk white clean beater whip white 1 2 cup sugar firm keep asid,0,1,0,0,0
combin dri ingredi bowl mix set asid saucepan heat nut butter coconut oil agav nectar honey cook medium heat mix often ingredi melt togeth remov heat pour dri ingredi quickli mix togeth use larg spoon spatula hand work quickli mixtur doe dri grab hand mixtur squeez firmli ball size walnut place seal contain keep fridg snack enjoy,1,0,0,0,0
boil water poach fish fillet easi one mistak guard overcook fillet even though poach moist way cook fish import halt process soon fish fulli cook fish cook longer 30 min usual turn dri strong unpleas odor aromat poach liquid greatli enhanc flavor help keep cook odor pleasant total elimin need ad calori laden oil butter flavor poach stock easili brew boil water short time varieti herb spice slice lemon lime orang whole fish like trout flounder succes poach roast pan top stove smaller delic portion fish fillet practic famili meal tail end fillet salmon,1,0,0,0,0
add ingredi mix glass,0,0,1,0,0
soak pancit noodl soften 10 minut set asid greas larg pan wok oil add garlic stir till almost brown add onion cook transluc garlic deep brown add chicken broth,0,0,1,0,0
prepar rice dash turmer dash ginger water cook heat larg fri pan griddl place chicken breast bowl add soy sauc teriyaki sauc line juic oyster sauc fish sauc toss drizzl littl oliv oil heat fri pan add chicken cook achiev beauti golden color tell chicken done firm meat drizzl littl oliv oil griddl place slice mushroom onion grill season mushroom onion dash salt black pepper,1,0,1,1,0
love bake brie make mine either puff pastri find heavi day also phyllo wrap remov wrap whole brie cut 1 8 top leav smooth surfac brie without rind cut edg turn brie upsid remov rest rind nake brie cover plastic wrap set asid melt stick butter set asid place 1 sheet phyllo flat surfac long end front butter sheet place anoth sheet phyllo top first sheet overlap half first sheet 1 1 2 width phyllo front butter sheet posit first sheet place fourth sheet third sheet posit directli second sheet 4 sheet phyllo doubl thick phyllo 1 1 2 time origin width thing height place 5th sheet phyllo guess get idea worri middl thicker go support weight brie use 8 sheet phyllo give anoth brush butter place brie center butter phyllo pile want add someth top brie time sometim spread top pesto sprinkl pesto layer pignoli nut anoth idea make past sun dri tomato cure black oliv spread top brie could also leav plain top add wonder flavor wrap done like packag 5flip wrap brie brush butter place cooki sheet bake preheat 375 oven phyllo puf golden brown brie insid melt cut wedg serv flip wrap brie brush butter place cooki sheet bake preheat 375 oven phyllo puf golden brown brie insid melt cut wedg serv,0,0,0,1,0
rins peel grate carrot heat ghee larg heavi saucepan add grate carrot ghee stir fri 15 20 minut moistur carrot ha evapor carrot darken color add milk evapor milk cardamom sugar carrot mixtur continu stir fri 30 35 minut rich brownish red color transfer carrot mixtur larg shallow dish decor pistachio serv onc,0,0,1,0,0
instruct,0,0,0,1,0
medium heavi bottom saucepan combin water sugar bring boil,0,1,0,0,0
thi recip use last six year noth rave review last three wife beeen take order christma thi year wa almost three hundr sold scale thi yield 4 pie fill pt 1 wash cut meat larg chunk brush rabbit beef meat magic place meat heavi pot let sit dice onion add 1 2 onion spice soup base add enough water cover cook medium heat meat easili remov bone strain reserv juic cool meat remov excess fat bone chop fine add follow fill pt 2 add enough reserv juic obtain semi moist textur dough knead thi dough mix pt 1 let dissolv set one side 10 minut larg bowl place pt 2 add 4 1 2 5 cup flour cup time obtain soft dough cover set asid 10 15 minut cut dough 8 piec roll piec dough 1 8 inch thick fit pie plate place 1 4 meat mixtur shell shell brush edg bottom crust water befor place top trim edg use fork press edg seal pie crust trim excess poke fork hole top allow steam escap cover fill pie let crust rais 30 40 minut cook pre heat 375 f oven golden brown,0,0,1,0,0
wash wild rice thoroughli elimin ani chaff,0,1,0,0,0
preheat oven 400 degre toss dice squash bowl 2tbsp oliv oil 1 2 tsp salt,0,0,1,0,0
combin dri ingredi bowl mix set asid saucepan heat nut butter coconut oil agav nectar honey cook medium heat mix often ingredi melt togeth,1,0,0,0,0
boil egg let cool peel egg slice half place egg yolk bowl 1 2 avocado mash togeth smooth season salt pepper combin coriand cumin oliv oil small bowl mix well combin oil mixtur avocado fill save drip top devil egg befor serv slice bacon bit cook slightli crispi spoon pipe avocado fill onto egg white sprinkl bacon bit top egg,0,0,0,1,0
soup pot heat 2 glug oliv oil med low heat add c c g transluc 15 20 minut add squash bay leaf coupl sprig fresh thyme p saute anoth 15 20 min med low heat squash start fall apart get soft cover veg stock cook anoth 20 min squash total soft may need adj amount look like get thick add littl water blend hand blender add half cup heavi cream adj season like add cinnamon nutmeg clove make spici festiv,1,0,0,1,0
medium size bowl blend bean lemon juic oil togeth make pure,1,1,1,0,0
heat oil cook onion,1,0,0,1,0
mix togeth small bowl salt pepper paprika marjoram savori garlic contain food processor combin beef half pork fat half ice water half mix season see step 1 process veri fine grind use meat grinder follow direct page 4 scrape mix bowl bowl combin remain season pork remain pork fat remain water process half mixtur time coars grind add beef mix togeth veri thoroughli cover chill 24 hour,1,1,0,0,0
pour tea ale larg bowl stir sugar add fruit leav fridg overnight,0,1,0,0,0
1 2 cup water 1 2 cup cottag chees 2 tsp agav nectar,1,0,0,0,0
melt butter heavi base casserol pour oil put dice bacon pancetta let colour littl add onion garlic leav cook moder heat onion soften yet colour scoop bacon onion drain spoon leav behind cook juic add chicken piec let brown lightli side moder heat best thi prepar add littl oil butter show sign brown,1,0,1,0,0
bowl combin breadcrumb herb de provenc paprika pepper stir well combin season chicken cube salt coat chicken piec flour dip egg coat breadcrumb mix time use hand fork thong make sure well coat breadcrumb mix heat oil check temperatur hot enough fri one bread chicken piec bubbl right chicken piec hit oil readi,0,0,1,0,0
fill larg pot water bring boil high heat liber salt water add pasta cook accord packag direct al dent drain toss 2 tbsp oliv oil set asid larg skillet heat rest oliv oil medium heat add mushroom red pepper rosemari sauté tender remov heat set asid small saucepan melt butter moder heat whisk flour form past slowli whisk milk combin cook slightli thicken reduc heat whisk chees stir constantli melt fulli incorpor,0,1,1,0,0
preheat oven 400f degre slice carrot bia 1 4 inch thick toss oliv oil salt tast,0,1,0,0,0
add ingredi mix glass shake larg ice strain coup garnish orang twist,0,1,0,0,0
