recipedetails,Audio,Image,Video,Text,other
wash sort pinto navi bean soak 8 hour overnight saut onion carrot garlic white wine place drain bean crockpot saute veget 6 cup water bouillon parsley liquid smoke cover cook least 8 hour sort rinc split pea lentil add pea lentil barley crockpot cover cook least 1 hour season tast 6 serv 219 4 calori 1 1 gram total fat,0,0,0,1,0
drop pea boil water boil uncov 5 10 minut pea almost quit tender finish cook later drain,1,0,1,1,0
larg heavi saucepan heat 1 4 cup oil saut fine ground meat onion veri fine chop crush garlic lightli brown add crush oregano crush basil cinnamon salt ripe oliv tomato sauc cover simmer slowli 30 minut uncov simmer slowli anoth 30 minut sauc simmer prepar bechamel sauc recip eggplant cut end eggplant 1 larg 2 small cut 1 2 inch thick slice use larg flask type eggplant peel skin strip veget peeler creat stripe look peel left use japanes style longish purpli white one bother peel place cooki sheet brush remain oliv oil place broiler broil light brown remov oven salt lightli turn eggplant repeat pr three way prepar potato thi delici casserol 1 shallow fri potato round oliv oil golden brown 2 fewer calori arrang potato slice bake pan brush lightli oliv oil bake 15 minut continu assembl 3 want cut calori parboil 8 minut drain well paper towel,0,0,0,1,0
cut wedg one end watermelon use larg spoon spoon melon leav thin layer red inner rind remov ani seed blender food processor blend watermelon lime juic tast add sugar bring desir level sweet strain fine strainer reserv refriger slice 1 4 inch layer bottom melon doe roll carv watermelon shape shark head simpli slice top make bowl add juic back watermelon vessel serv,0,0,0,1,0
mix ingredi togeth let mixtur rest 10 minut loaf pan befor bake larg loaf pan bake 350 70 minut,0,0,0,1,0
preheat oven 375 f line bake sheet parchment paper silpat bake mat larg bowl combin sugar ginger nutmeg cinnamon salt bake soda mix well add melt butter evapor milk molass add vanilla extract mix well add flour 1 cup time stir constantli combin add ¼ cup addit flour necessari prevent stick scoop spoon dough put 2 evenli apart cooki sheet flatten dough fingertip ¼ thick use littl flour hand necessari prevent stick bake 10 minut done remov cooki cool rack cool complet befor frost mapl ice bacon bit wa favorit top,0,0,0,1,0
direct slice appl lengthwis use melon baller scoop flesh appl leav meat skin appl place appl halv muffin pan keep upright note muffin pan use 2 oz plastic cup instead,1,1,1,0,0
place ingredi small saucepan bring gentl boil stir occasion reduc heat low simmer 45 minut syrup ha thicken remov heat cool strain fine mesh siev pour syrup squeez bottl place candi rose petal contain tight fit lid readi serv altern 2 scoop ice cream rose petal syrup two parfait glass,0,1,0,0,0
drop pea boil water boil uncov 5 10 minut pea almost quit tender finish cook later drain pea serv immedi refresh cold water 3 4 minut stop cook retain thi color textur drain roll pea saucepan moder heat moment two evapor moistur roll sugar salt pepper butter cover cook veri low heat 10 minut toss occasion tender correct season turn hot veget dish toss fresh mint serv soon possibl,1,0,1,1,0
pud preheat oven 375 butter flour 8 inch squar pan place date water ginger small saucepan simmer medium heat uncov 5 minut remov heat pan stir bake soda mixtur foam let mixtur stand 20 minut wait sift togeth flour bake powder salt set asid larg bowl cream butter sugar togeth light fluffi beat egg one time mix flour mixtur three batch beat addit combin add date mixtur stir combin pour batter bake pan set insid larger bake pan add enough hot water larg bake pan reach half way side smaller bake pan bake middl oven 35 40 minut done remov pud water bath cool serv toffe sauc vanilla ice cream toffe sauc 2 quart saucepan melt butter moder heat add brown sugar bring mixtur boil stir occasion add cream scotch reduc heat simmer sauc stir occasion slightli thicken five minut cool sauc slightli pour squar pud,0,1,0,1,0
dilut basic chines stock 10 qt bring dilut broth boil let cool 200 degre place chicken broth broth cool 170 keep chicken broth 165 degre cook time approxim 40 min per lb,1,1,0,0,0
thi recip appear cookbook live russian far east near china love cook thi salad day day basi dinner parti serv salad puff pastri basket ingredi thi salad simpl may found everi pantri wash boil carrot separ pot wash boil rice separ pot boil egg hard boil rice ha boil soft cook carrot ha cook overcook rice cook drain rins cold water egg cook 6 8 min put cold water cool carrot drain let cool peel fine chop onion 1 2 drain rins corn 3 4 cup peel fine chop carrot rice cool mix carrot onion corn shell chop egg wash chop dill crab meat use real crab meat simul crab flake even shrimp wa use simul crab meat cut crab meat mid size piec add salad add salt pepper salad mix ingredi well,0,1,0,0,0
kabaklarin disini soyup rendeleyin taze soganlari kucuk kucuk dograyin maydonozlari dere otlarini inc inc kiyin taze soganlari sivi yag ile kavurun uzerin rendelenmi kabaklari ilav edin biraz daha kavurun daha sonra pirinc su ilav edin suyunu tamamen cekincey kadar pisirin sogumaya birakin sarmisakli yogurt hazirlayip soguyan karisimin uzerin bosaltin tuz ilav edip tavada kizdirilmi tereyagini servisten onc uzerin gezdirerek dokun afiyet olsun,1,1,1,1,0
prepar,0,1,0,0,0
dri appl pear prune cook water soft,0,1,0,0,0
bake 350 degre 1 2 hour pound breast dip egg coat bread crumb fri oil marin bake dish overnight soup wine chicken broth cover foil bake,0,0,1,0,0
pre heat oven 375 degre f toss potato sweet potato ½ tablespoon oliv oil season salt pepper garlic powder chili powder put bake tray cook oven 15 minut stir everi 5 minut,1,1,0,0,0
heat 1 tbsp oil medium high heat,1,0,0,0,0
cake preheat oven 350f butter 9 inch cake pan bowl sift togeth flour bake powder salt whisk togeth cream butter 3 4 cup sugar mixer heavi wooden spoon whisk egg yolk milk vanilla extract mixtur smooth whisk flour mixtur 1 2 cup time overwork beat egg white cream tartar 2 minut soft peak add remain 3 tbsp sugar beat medium peak whisk one forth egg mixtur butter mixtur lighten fold rest egg white mixtur rubber spatula spread batter cake pan bake 40 50 minut toothpick insert center come clean let cool 5 minut cake pan transfer cool rack cool complet cake room temperatur insert 4 toothpick 4 side cake mark middl long bread knife cut cake 2 halv lengthwis along toothpick syrup mix sugar water brandi thoroughli sugar dissolv place fridg cake readi assembl coffe mouss readi use pastri brush spread syrup 2 halv let soak 3 5 minut befor ad mouss mouss soak gelatin 1 4 cup water 3 minut heat microwav 1 2 minut let sit 3 minut gelatin water becom complet clear add instant coffe 2 tbsp warm water stir till melt food processor blender process cottag chees smooth add brandi coffe vanilla essenc 1 4 cup sugar gelatin blend uniform consist whisk 4 egg white cream tartar soft peak add remain 1 4 cup sugar beat medium peak fold egg white chees mixtur,0,1,0,0,0
preheat oven 400 line larg 9 inch pie plate roll pastri dough prick fork bake 10 minut remov oven reduc heat 350 small bowl combin sugar flour salt mix well spread evenli bottom crust warm cream microwav warm hot care pour warm cream sugar mixtur complet cover bit dab butter cream,0,0,0,1,0
start make dough ravioli add food processor ravioli ingredi run processor mix ingredi well dough look like pebbl touch dri add 1 2 1 tsp water mix form nice ball dough onc dough mix bring processor knead minut cover ball pasta dough plastic wrap let rest good twenti minut dough rest let whip tasti fill grab skillet heat butter medium heat add garlic next add proscuitto onion mushroom,0,0,0,1,0
mix abov ingredi togeth form ball brown hot skillet mix togeth one bottl chili sauc grape jelli add meatbal veri brown cover simmer 15 20 minut serv cook noodl rice,0,1,0,0,0
melt butter saucepan add flour stir wooden spoon add milk gradual stir rapidli whisk blend smooth add garlic pepper nutmeg add enough milk obtain consist requir simmer gentli 5 minut stir bottom regularli ensur doe burn remov sauc heat whisk combin egg yolk cream sauc thick creami reboil ad egg yolk,0,1,0,0,0
cover potato salt water boil till tender drain mash stir soften butter sour cream chive season salt pepper,1,0,0,0,0
advanc prep peel cube potato cook fork tender mash set asid cook onion butter low flame soft color add potato mix electr mixtur care beat creme fraich onion potato light fluffi season salt pepper,1,0,0,0,0
cook stuf cook ground beef dice onion oil add spice add wash drain rice add cardamom,1,0,0,0,0
boil egg let cool,0,0,0,1,0
use pre packag lemongrass section follow ha like done alreadi case skip thi step otherwis peel outermost layer stalk lemongrass wash cut long stalk approx 6 inch section use sharp knife lightli score stalk sever time toward middl lay asid cut board food processor fine minc purpl basil add minc basil larg mix bowl add ground pork curri shrimp past bowl basil use hand larg spoon mix bowl content uniformli blend portion blend mixtur one good size meatbal lemongrass section,1,0,0,1,0
fill combin saucepan abov ingredi allow mixtur simmer low thicken crust preheat oven 350 degre cut butter dri ingredi work finger incorpor make well center add milk combin dough milk use hand stir loosen side place dough onto lightli flour surfac quickli gentli knead,0,0,1,0,0
spanish gazpacho soup place ingredi blender vitamix blend well smooth 3 minut,0,1,0,0,0
heat 2 tbsp oil add prawn stir fri chang color reduc low heat add lee kum kee sauc tomato garlic prawn stir well quickli heat dish serv hot,1,0,0,1,0
split hot dog wiener along top fill onion chees place crescent roll board mash flat place wiener widest end roll wiener bake sheet foil cooki sheet 375 degre done great serv gather teenag pre teen,0,1,0,0,0
wipe mushroom care remov stalk fine chop stalk melt butter fri pan add onion garlic chop mushroom stalk cook togeth 3 minut add bacon pan cook 3 minut remov heat stir breadcrumb chees parsley season lemon juic,0,0,0,1,0
hot pan add tvp cook 1 2 minut add mix spice top make sure incorpor spice veri well tvp let cook 5 minut liquid ha evapor,0,1,0,0,0
combin coconut red chile mustard seed cumin seed sugar 2 tablespoon water bowl food processor process ingredi well combin start form coars past 15 second,0,1,1,0,0
combin flour salt confection sugar larg bowl use tip finger rub butter flour look mostli like wet sand make well middl pour egg gradual work egg flour moist dough form use heel hand distribut ani remain larg piec butter shape 5 inch disk cover plastic wrap refriger 1 hour thi done food processor roll dough 13 inch circl lay dough 11 inch tart pan remov bottom press side secur dough refriger one hour preheat oven 325 f dock bottom crust fork lay larg crumpl piec parchment top pour pie weight pound dri bean bake 25 minut crust light golden brown set asid,0,0,0,1,0
preheat oven 400 degre toss dice squash bowl 2tbsp oliv oil 1 2 tsp salt spread squash bake sheet place oven roast 25 minut may want turn squash least onc transfer squash back bowl mash warm 1 tbsp oliv oil skillet add onion saut lightli brown 10 minut add pecan saut 2 minut add squash cook heat 1 minut add mapl syrup season salt pepper transfer fill bowl let cool room temp readi fill wonton wrapper set work surfac bowl water pastri brush flat area cover wax parchment paper rest tortellini place one wrapper time flat work surfac middl place heap spoon fill wet edg wrapper well water fold wrapper half triangl shape make sure wrapper well seal burst boil water cook take two end triangl fold togeth stick tortellini look like cook boil water salt well drop totellini small batch cook onli minut two rise top,0,1,0,0,0
make 7 dozen heavi saucepan combin brown sugar margarin veget shorten molass heat brown sugar dissolv dissolv bake soda boil water stir molass mixtur mixtur bubbl remov heat sift flour spice togeth gradual add saucepan stir wooden spoon well incorpor form dough rectangl wrap let set overnight refriger,0,0,0,1,0
heat oil cook onion add dice zucchini cook 2 3 minut add pea stock turmer pan bring boil cover simmer split pea tender,1,0,0,0,0
small bowl whisk togeth lemon juic oliv oil honey mustard garlic salt pepper,0,0,0,1,0
note author say 1 tsp dri mint could use dri mint nasti stuff imho pour water 1 quart saucepan add quinoa bring boil reduc heat simmer cover cook 10 15 min water ha absorb quinoa cook fine chop tomato parsley scallion add lemon juic oil mint tomato mixtur stir cook quinoa salt mix well let tabouli sit refriger day blend flavor note also neglect mention tabouli tradit serv room temperatur recip wa linda najjar seattl washington herb companion note said ubstitut quinoa tradit bulgur wheat give thi tabouli lighter fluffier slightli nutti tast enabl peopl allerg wheat experi flavor joy thi middl eastern dish,0,1,0,0,0
place ingredi food processor hand blender blitz smooth,0,0,0,1,0
small saucepan scald milk heat add 1 3 cup butter sugar salt stir butter melt cool lukewarm larg mix bowl dissolv yeast water whisk milk mixtur egg blend add 3 cup flour mix smooth gradual thoroughli mix 2 cup flour dough soft turn lightli flour surfac knead smooth elast 5 8 minut use remain 1 2 cup flour keep dough stick place dough larg greas bowl turn greas top cover let rise warm place doubl bulk 30 40 minut divid dough half lightli flour surfac roll 1 2 14x10 inch rectangl spread 1 tablespoon soft butter sprinkl half sugar cinnamon mixtur start long side roll jelli roll fashion punch edg seal cut 12 piec set asid second half dough make top divid thi syrup two greas 13x9 inch pan sprinkl nut syrup place 12 slice dough cut side pan cover let rise warm place doubl bulk 30 40 minut,0,0,0,1,0
boil sparerib larg pot 45 minut rib parboil mix remain ingredi larg pan marinad put boil rib marinad let marin 2 hour turn 1 hour broil rib grill oven coat side honey watch rib begin crisp turn bast marinad begin brown rib done note want parboil rib first bake 250 degre 40 minut 350 degre 20 minut 400 degre 5 minut serv rice,1,0,0,0,0
start make dough ravioli add food processor ravioli ingredi run processor mix ingredi well dough look like pebbl touch dri add 1 2 1 tsp water mix form nice ball dough onc dough mix bring processor knead minut cover ball pasta dough plastic wrap let rest good twenti minut dough rest let whip tasti fill grab skillet heat butter medium heat add garlic next add proscuitto onion mushroom let cook minut two add salt oregano give swirl two around pan mix add spinach let spinach wilt complet remov mixtur heat time grab well rest pasta dough pop ravioli rip sixth ball run pasta maker hand roll desir thin ravioli cutter use use glass cut circl like use cooki cutter make fun shape celebr holiday ravioli cut drop good teaspoon prosciutto mixtur center pasta brush edg egg wash egg white one egg place anoth pasta piec top seal edg finger fork whatev put smile face,0,0,0,1,0
place bread bowl drizzl melt butter mix well coat anoth bowl whisk egg sugar milk nutmeg vanilla togeth,0,1,1,0,0
line 8x8 squar pan tin foil set asid add frost anim cracker cream chees food processor run high thing stop move scrape side bowl move cooki mixtur around spatula continu process high cooki cream chees smooth creami may take time stop scrap bowl set asid add white chocol candi melt microwav safe bowl microwav 30 second stir repeat microwav 30 second stir candi melt complet melt add half white chocol bottom tin foil line pan spread evenli offset spatula let harden speed process place fridg 15 minut ha set onc white chocol hard dump anim cracker mixtur spread evenli possibl use hand wax paper use hand becaus wa easier avail reheat white chocol need microwav 30 second stir pour remain white chocol top anim cracker mixtur tri drizzl easier coat everyth work quickli add pink candi melt sandwich bag microwav 30 second stir pinch back flip microwav repeat microwav pinch bag smooth cut small corner sandwich bag drizzl pink candi melt top wet white chocol give nice littl design fill ani hole tap pan counter smooth chocol sprinkl nonpareil top chocol tap otherwis sprinkl sink place fridg chill thi take 1 hour,0,1,0,0,0
medium mix bowl cream butter sugar well add egg yolk sour cream mix,1,0,0,0,0
coat steak filet fresh ground coars pepper salt tt saut steak skillet 1 2 tbsp butter oil til desir temp remov keep warm pan melt 2 tablespoon butter medium heat saut shallot shortli add mushroom garlic,0,1,1,1,0
pan pour two inch oil heat medium heat till hot cut chicken diagon thick strip two inch wide bowl beat egg anoth contain place flour coat chicken strip egg mixtur first gener pat flour cover side often give coupl coat thick layer batter chicken piec oil hot fri chicken piec till golden brown 3 minut side,0,1,0,0,0
make sugar syrup combin water sugar saucepan bring boil simmer fifteen minut pour syrup onto blackcurrantsliquid pass fine siev make sure seed remov stir creme de cassi befor turn ice cream machin add squeez lemon juic thi one sorbet never found necessari use fresh blackcurr fact frozen one better avail year round appli raspberri serv 4,0,1,0,0,0
preheat oven 350 degre medium bowl stir togeth flour ginger bake soda cinnamon clove salt set asid larg mix bowl beat shorten electr mixer low speed 30 second add 2 cup sugar beat combin scrape side bowl occasion beat egg molass combin beat much flour mixtur mixer stir ani remain flour mixtur shape 1 inch ball roll ball 3 4 cup sugar place 1 1 2 inch apart bake sheet bake 8 9 minut bottom lightli brown top puf overbak cool cooki sheet 1 minut transfer wire rack,1,0,0,0,0
start crust combin flour sugar salt larg bowl add chill butter combin pastri blender add shorten combin cut flour butter mixtur mixtur resembl coars cornmeal slowli add ice water tablespoon mix well addit dough begin stick togeth place dough flat surfac divid 2 even piec roll ball dust lightli flour wrap plastic place fridg least hour dough chill drop chicken tender boil water cook longer pink insid approxim 2 4 minut set asid small bowl cool tear piec mixtur larg small deep wide skillet melt butter oil add garlic carrot celeri onion potato bay leav cook carrot soften bit mushi approxim 10 minut mix cornstarch flour milk mix well add cook veget toss pea cook mixtur begin thicken approxim 8 10 minut stir remain herb spice chicken half chees remov bay leav take heat allow cool chicken fill cool take dough fridg roll one ball bottom half crust drop 9 inch pie dish trim edg place fridg roll second piec dough top crust pull crust pour chicken fill dish sprinkl remain chees top top crust trim edg bit roll top crust edg bottom crust press togeth around fork cut slit top crust,0,1,1,0,0
thi recip use last six year noth rave review last three wife beeen take order christma thi year wa almost three hundr sold scale thi yield 4 pie,1,0,0,0,0
cake preheat oven 350f butter 9 inch cake pan bowl sift togeth flour bake powder salt whisk togeth,0,1,0,0,0
heat 1 tbsp oil medium high heat saut sausag 5 minut get brown side add spinach stir minut two spinach begin wilt cut slit sweet potato fill sausag spinach,0,1,0,0,0
greas 10 inch springform pan line bake paper prepar curst combin siev first five ingredi first bowl cut butter egg smooth dough form press firmli bottom side prepar pan use fork prick crust regular interv cover chill crust 30 minut pre heat oven 200c 400f stir chop chocol sugar heatproof bowl set pan simmer water melt smooth remov bowl water stir vanilla extract let cool briefli lukewarm still pourabl,0,1,0,0,0
fillet frozen thaw mix corn flour salt white pepper dredg fillet flour mixtur set asid,0,0,1,0,0
strain juic mulberri press much pulp possibl measur use fresh berri prepar juic cook berri enough water keep burn strain sweeten tast sugar syrup add grape juic lemon juic chill fill glass one third full add water crush ice,1,1,0,1,0
prepar crust sprinkl gelatin water soften mix sugar cornstarch salt top doubl boiler gradual stir eggnog cook hot water stir constantli thicken remov heat stir soften gelatin dissolv divid fill half add melt chocol vanilla one half set asid allow remain half cool add rum whip cream pour rum flavor mixtur pie crust pour chocol mixtur top chill least 6 hr overnight,1,0,0,1,0
mix bowl combin beef patti ingredi except avocado oil form 8 long patti hand brush littl oil patti,0,0,1,0,0
line 8x8 squar pan tin foil set asid add frost anim cracker cream chees food processor run high thing stop move scrape side bowl move cooki mixtur around spatula continu process high cooki cream chees smooth creami may take time stop scrap bowl set asid add white chocol candi melt microwav safe bowl microwav 30 second stir repeat microwav 30 second stir candi melt complet melt add half white chocol bottom tin foil line pan spread evenli offset spatula let harden speed process place fridg 15 minut ha set onc white chocol hard dump anim cracker mixtur spread evenli possibl use hand wax paper use hand becaus wa easier avail reheat white chocol need microwav 30 second stir pour remain white chocol top anim cracker mixtur tri drizzl easier coat everyth work quickli add pink candi melt sandwich bag microwav 30 second stir pinch back flip microwav repeat microwav pinch bag smooth,0,0,1,0,0
bring 1 2 litr water boil saucepan use small endo thermal magic cooker add drain white wheat let simmer 7 10 minut remov pot stove place magic cooker cover let wheat continu cook use heat pot 30 minut remov pot simmer low heat anoth 5 minut togeth pandan leav done place pot back magic cooker cover let cook anoth 15 20 minut till wheat becam soften remov pandan leav add cane sugar caster sugar tast simmer pot stove low heat turn heat stir pinch salt ladl serv bowl serv coconut cream milk gula maleka syrup accord person prefer normal pot simmer white wheat 1 3 litr water low heat least 40 50 minut add pandan leav 30 minut later till wheat soften stir sugar tast serv coconut cream milk,1,0,1,0,0
cook chicken till tender debon chicken reserv broth,0,0,1,0,0
butter lightli brown rice vermicelli rice roni stir hot water chicken raisin rice roni flavor packet curri powder cover simmer 15 minut garnish top peanut coconut 4 serv,0,1,1,0,0
work surfac open bone lamb make close rectangl care trim much fat possibl dispos chop anchovi fine combin small bowl dri thyme minc garlic oil add half teaspoon salt mix altogeth spread half thi mixtur lamb roll tie tightli string befor spread rest anchovi mixtur outsid small pan combin stock vermouth bring boil reduc enthusiast simmer stir mustard cream continu simmer roast lamb sauc want reduc coat consist half cup finish enough spoon serv lamb,0,1,0,0,0
preheat oven 325 degre fold 12 piec aluminum foil 13 4 top 4 inch length half twice wrap fold foil around small spice bottl creatr mold leav top mold open pour batter arrang cooki sheet shallow pan greas insid mold light coat nonstick spray disregard direct box cake mix instead beat egg white stiff combin cake mix water beat thoroughli blend 2 minut pour batter mold fillng one 3 4 inch bake 30 minut cake golden brown toothpick stuck center come clean,0,1,0,0,0
direct combin ingredi bowl store airtight contain refriger one month,1,0,0,0,0
heat wok cook oil add green onion fri till fragrant follow broad bean fri till broad bean turn slightli brown outsid add water simmer cover wok 2 3 minut water dri add salt sugar mix well dish serv immedi,0,0,1,0,0
step 1 bowl add paneer cube corn flour mix well step 2 heat oil pan deep fri paneer crisp golden brown remov absorb paper soak extra oil keep asid step 3 heat 2 tbsp oil pan add dri red chilli garlic ginger green chili sauté time step 4 add onion capsicum sauté well,0,0,0,1,0
preheat oven 400f greas bake sheet set asid larg bowl combin flour salt toss fork blend add lard work fat flour mixtur fingertip mixtur resembl coars meal make well center mixtur add cream water stir combin well turn onto lightli flour work surfac knead 3 4 time dough hold togeth pat dough 1 inch thick begin beat use wooden mallet implement gentl rhythmic motion entir surfac ha well beaten fold dough half repeat process continu beat fold dough well blister 20 30 minut roll dough 1 2 inch thick cut round flour 2 inch biscuit cutter rerol scrap cut dough ha use,0,0,1,0,0
blend ingredi blender 10 second save refriger 1 2 day add 2 tablespoon milk,1,0,0,0,0
saucepan bring 1 3 4 cup water 1 tbsp butter boil stir half packag grain bring boil reduc heat cover let sit 10 minut fluff fork,0,0,1,0,0
saut onion pepper cook pasta drain add pepper onion bacon add 2 egg stir med heat egg start cook want egg becom scrambl creami side add pepper parmesan tast pasta mix flour salt oliv oil beat egg food processor mixmast doe thi veri easili well combin add water work thi becom dough ball knead two minut stretch dough fold put plastic bag store fridg least half hour,0,1,0,0,0
combin flour salt confection sugar larg bowl use tip finger rub butter flour look mostli like wet sand make well middl pour egg gradual work egg flour moist dough form use heel hand distribut ani remain larg piec butter shape 5 inch disk cover plastic wrap refriger 1 hour thi done food processor,0,0,0,1,0
direct add ginger cilantro food processor puls 5 time fine chop add avocado lime juic coconut milk feta parmesan chees blend mix add spice cumin chili powder paprika cayenn pepper garlic powder salt puls 5 time,0,0,0,1,0
heat oven 350 degre f greas 2 loaf pan 9x5x3 mix flour bake soda salt bake powder cinnamon clove cream shorten sugar thoroughli add egg pumpkin water add dri ingredi gradual mix well stir pecan pour loaf pan bake 65 70 minut wooden pick come clean remov pan cool rack eat,0,1,0,0,0
