recipedetails,Audio,Image,Video,Text,other
preheat oven 375 degre meanwhil get start crust bowl combin cracker crumb nut cinnamon stir butter press crust mixtur bottom 2 inch side 9 inch springform pan make fill mixer bowl combin cream chees sugar cornstarch vanilla beat fluffi add egg yolk onc beat low speed combin fold cream pumpkin pulp appear broken bake beauti pour crust line pan place shallow bake pan oven bake 35 40 minut center appear nearli set shaken cool 15 minut loosen side pan cool 30 minut chill 4 hour befor serv 4thi recip yield 6 8 serv,1,0,0,0,0
pré aqueça forno 220 em uma travessa esfregu pernil com azeit sal e pimenta reino moida na hora coloqu forno por 30 min cort berinjela ao meio e cubo de 5 cm mistur com cebola azeit e temper com sal e pimenta reino e orégano,0,0,0,1,0
bring boil simmer rice cabbag done,1,0,0,1,0
combin ingredi,1,0,0,0,0
sift flour salt togeth larg bowl add egg yolk enough cold water make stiff dough knead thoroughli cover dough damp cloth let stand 30 minut sprinkl board roll pin addit flour roll dough paper thin fold dough long loos roll cut crosswis strip 1 10 inch wide unrol dough strip least 12 inch long,0,0,1,0,0
direct slice appl lengthwis use melon baller scoop flesh appl leav meat skin appl place appl halv muffin pan keep upright,1,1,1,0,0
preheat oven 175c line bake sheet bake paper larg bowl combin roll oat pecan nut coconut flake stir allspic cinnamon add dri fruit stir well evenli mix make sure dri fruit stick togeth big batch,0,0,1,0,0
wash lentil well transfer larg pot add tomato carrot salt cover water bring boil simmer 30 minut remov heat pure blender,1,0,0,0,0
add rice 2 cup boil stock cover cook tender 20 minut anoth pot blend tomato juic tomato past garlic bring boil reduc heat simmer 5 minut add cumin cilantro stir cook rice season tast readi serv blend remain hot stock enough make desir consist ladl bowl top garnish,1,0,1,1,0
spanish gazpacho soup place ingredi blender vitamix blend well smooth 3 minut refriger 1 2 hour befor serv garnish organ crunchi onion chop parsley dri,0,1,0,0,0
one trick incred flavor thi risotto broth let start saucepan medium heat add 3 tbsp butter mushroom season salt pepper onc good amount moistur cook mushroom lightli brown add veget broth water chop parsley simmer 20 minut voila beauti mushroom broth onc broth ha cook 15 minut go ahead start risotto larg sauté pan rice plump quit bit medium low heat add 3 tbsp butter oil add onion garlic cook soften season salt pepper next add arborio rice toss coat well mixtur continu stir rice toast opaqu clear speck white center grain,1,0,1,1,0
sift dri ingredi cut shorten pastri blender piec size small pea stir egg blend wine one tablespoon time dough cling togeth refriger sever hour roll paper thin flour surfac cut 5 inch circl roll around 6 inch stick cannoli form wrap dough 1 4 inch stick tube protrud either end seal brush beaten egg yolk fri 2 time deep hot fat 375 degre minut golden brown lift slot spoon onto paper towel cool remov stick tube gentli beat ricotta larg bowl 1 minut add sugar beat veri light creami 5 minut add cinnamon vanilla citron chocol chip,0,1,0,0,0
preheat oven 425 f 210 c wear rubber glove seed quarter chilli length add chilli oliv oil jar cover lid sliver garlic clove add oliv oil add cider vinegar shake well,0,1,0,0,0
chop chocol small chunk place mix bowl place whip cream heat proof vessel microwav 2 3 minut high boil veri care pour whip cream top chocol allow sit one two minut whisk chocol cream chocol blend sift powder sugar mix combin add peanut butter mixtur still warm mix pb blend consist mixtur go like thick chocol milk thi time place bowl fridg 30 45 minut whip mixtur frost like consist,0,0,1,0,0
stockpot heat oil medium heat add onion saut soft 5 minut stir garlic reduc heat medium low cook stir occasion onion almost caramel 35 minut add potato slice tomato stock broth lemon zest juic bring boil medium high heat cover reduc heat low simmer potato tender 30 minut stir salt pepper tast befor serv stir chop mint cilantro,1,0,1,0,0
spong method,0,1,0,0,0
mix ingredi cake cream chees sugar egg vanilla pumpkin smooth butter glass pan bake 350 degre 20 minut remov oven cool 15 minut mix sour cream sugar vanilla spoon top cool cheesecak bake anoth 10 minut sprinkl cinnamon option,1,0,1,0,0
soak almond overnight,0,1,0,1,0
dilut basic chines stock 10 qt,1,1,0,0,0
wipe mushroom care remov stalk fine chop stalk melt butter fri pan add onion garlic chop mushroom stalk cook togeth 3 minut add bacon pan cook 3 minut remov heat stir breadcrumb chees parsley season lemon juic arrang mushroom lightli greas ovenproof dish divid stuf,0,0,0,1,0
combin dri ingredi bowl mix set asid saucepan heat nut butter coconut oil agav nectar honey cook medium heat mix often ingredi melt togeth remov heat pour dri ingredi quickli mix togeth use larg spoon spatula hand work quickli mixtur doe dri grab hand mixtur squeez firmli ball size walnut,1,0,0,0,0
wash wild rice thoroughli elimin ani chaff pot soften rice less 2 part water 1 part rice bring rice boil 5 minut simmer low medium 20 minut want rice split yet mushi consist watch care brown meat drain greas brown celeri onion use littl greas sausag combin meat celeri onion rice chicken broth cream mushroom pour casserol dish go want inch half depth casserol make sure big dish bake cover 350 1 ½ hour remov oven top tater tot bake anoth 30 minut cover remov oven add mozzarella bake uncov 10 minut,0,1,0,0,0
larg saucepan combin egg 1 teaspoon salt cover cold water bring boil reduc heat simmer 20 minut remov heat drain cool cool tap egg back spoon crack shell remov shell,0,0,0,1,0
boil egg let cool peel egg slice half place egg yolk bowl 1 2 avocado mash togeth smooth season salt pepper combin coriand cumin oliv oil small bowl mix well combin oil mixtur avocado fill save drip top devil egg befor serv,0,0,0,1,0
mix warm milk sugar yeast small bowl yeast dissolv set asid blend flour bake powder salt lemon zest larg bowl electr mixer add butter blend mixtur crumbl beat egg egg yolk vanilla small bowl add flour mixtur altern milk mixtur blend dough come togeth transfer dough flour board divid dough 4 part knead part flat disc wrap plastic wrap refriger 1 hour,0,0,1,0,0
make sugar syrup combin water sugar saucepan bring boil simmer fifteen minut pour syrup onto blackcurrantsliquid pass fine siev make sure seed remov,0,1,0,0,0
preheat oven 200 c pan medium high heat add onion butter fennel garlic allow go golden add prawn salt vinegar pepper fennel seed turn heat medium allow simmer 20 minut final add cream chilli mix thoroughli allow simmer anoth 10 minut meanwhil take filo sheet take one use pastri brush butter sunflow oil edg edg place anoth sheet top thi 5 sheet add third prawn mixtur centr less filo sheet small oil outer part filo sheet bring filo togeth like photo tie string secur thi 2 time 3 parcel,0,0,0,1,0
mash berri potato masher measur pulp add one pint sugar pint pulp bring mixtur full bubbl cook 30 minut sure skim mixtur pot paraffin seal properli best skimmer wooden spoon ladl preserv steril jar melt paraffin care remov bubbl steril spoon pour 1 4 inch thick top jar preserv,0,0,0,1,0
preheat oven 425 degre combin rub ingredi bowl mix well,0,0,0,1,0
preheat oven 350 degre f mix ingredi togeth well place 1 3 cup 2 oz mixtur 16 muffin cup bake 350f done 1 hour remov muffin tin serv hot cold,1,0,0,0,0
larg bowl mix togeth ground beef bread crumb egg onion salt ranch dress mix well blend leav stand 5 minut shape walnut size meatbal place bake sheet make around 23 meatbal bake 30 minut oven 190 c turn half way meanwhil combin ketchup tomato pure appl cider vinegar cola onion bell pepper vegeta pepper worcestershir sauc remov meatbal bake sheet place suitabl pan cover sauc cover pan cook 1 hour veri low heat serv green salad homemad ranch style dress season mix mix well ingredi,1,0,1,1,0
larg mix bowl beat butter peanut butter electr mixer medium high speed 30 second add granul sugar brown sugar bake soda bake powder beat combin scrape side bowl occasion beat egg vanilla combin beat much flour mixer stir ani remain flour,0,1,0,0,0
turn oven 200 c two cocottin line parchment paper divid circl puff pastri lay crescent cocottin obtain tri form basket leav contain part sheet form crunchi bit prick bottom pastri fork cover insid basket bake paper fill ceram weight dri chickpea bake 10 minut remov wax paper weight bake 6 minut meanwhil chop walnut leav herb bring boil salt water cook tortellini 5 minut larg fri pan gentli heat butter add chop nut herb cook minut add cream heat low heat coupl minut,0,1,1,0,0
pud preheat oven 375 butter flour 8 inch squar pan place date water ginger small saucepan simmer medium heat uncov 5 minut,1,1,0,0,0
cut coconut thin strip roast medium flame five minut put wide plate roast chilli powder oil second grind ingredi togeth garlic dri chutney readi store airtight contain,0,0,0,1,0
peel potato cut strip use mandolin 1 8 thick larger deep fryer avail heat oil maximum high cook follow fryer instruct use regular fri pan add enough oil come side least 1 inch high heat warm oil good test see oil hot enough add 1 french fri oil bubbl around add half potato overcrowd nice golden color remov slot spoon drain paper towel,0,1,0,0,0
preheat oven 400f greas bake sheet set asid larg bowl combin flour salt toss fork blend add lard work fat flour mixtur fingertip mixtur resembl coars meal make well center mixtur add cream water stir combin well turn onto lightli flour work surfac knead 3 4 time dough hold togeth pat dough 1 inch thick begin beat use wooden mallet implement gentl rhythmic motion entir surfac ha well beaten fold dough half repeat process continu beat fold dough well blister 20 30 minut,0,0,1,0,0
preheat oven 200 degre c whisk togeth melt butter sugar add one egg time mix well batter turn fluffi,1,0,0,0,0
plung tomato boil water 30 second remov slot spoon transfer bowl ice water remov water slip skin chop tomato set asid larg pot saut mustard seed oil medium heat begin sputter pop add garlic bay leaf turmer rice stir rice becom transluc 2 minut add tomato reduc heat simmer 3 minut add broth bring back boil 2remov heat add cilantro allow steam cover 5 minut remov bay leaf fluff fork stir cilantro,1,0,0,0,0
cook stuf cook ground beef dice onion oil add spice add wash drain rice add cardamom add littl bit water cover cook rice half way turkey prepar wash turkey lemon oliv oil pat dri rub spice insid skin stuff turkey rice beef mix line pan aluminum foil use dispos pan wrap turkey aluminum foil bundl turkey foil bake 350 degre fahrenheit oven,1,0,0,0,0
preheat oven 375 degre f slice squash length wise place face casserol dish 1 4 water bottom bake 30 minut squash tender cool bit touch squash scoop seed scoop squash flesh bowl set asid larg stock pot heat butter sauté onion low medium heat transluc add garlic curri powder red pepper flake salt pepper onion add squash cauliflow pot along stock simmer 20 minut pure squash cauliflow along liquid batch blender add bit stock littl time think mixtur thick transfer soup bowl serv dollop sour cream,1,0,0,0,0
pud preheat oven 375 butter flour 8 inch squar pan place date water ginger small saucepan simmer medium heat uncov 5 minut remov heat pan stir bake soda mixtur foam let mixtur stand 20 minut wait sift togeth flour bake powder salt set asid larg bowl cream butter sugar togeth light fluffi beat egg one time mix flour mixtur three batch beat addit combin add date mixtur stir combin pour batter bake pan set insid larger bake pan add enough hot water larg bake pan reach half way side smaller bake pan bake middl oven 35 40 minut done remov pud water bath cool serv toffe sauc vanilla ice cream toffe sauc 2 quart saucepan melt butter moder heat,1,0,0,1,0
small saucepan scald milk heat add 1 3 cup butter sugar salt stir butter melt cool lukewarm larg mix bowl dissolv yeast water whisk milk mixtur egg blend add 3 cup flour mix smooth gradual thoroughli mix 2 cup flour dough soft turn lightli flour surfac knead smooth elast 5 8 minut use remain 1 2 cup flour keep dough stick place dough larg greas bowl turn greas top cover let rise warm place doubl bulk 30 40 minut divid dough half lightli flour surfac roll 1 2 14x10 inch rectangl spread 1 tablespoon soft butter sprinkl half sugar cinnamon mixtur start long side roll jelli roll fashion punch edg seal cut 12 piec set asid second half dough make top divid thi syrup two greas 13x9 inch pan sprinkl nut syrup place 12 slice dough cut side pan,0,0,0,1,0
preheat oven 350 f,0,0,1,0,0
mix ingredi bowl make meatbal size ball mix hold togeth well add g free breadcrumb sticki,1,0,0,0,0
bowl combin breadcrumb herb de provenc paprika pepper stir well combin season chicken cube salt coat chicken piec flour dip egg coat breadcrumb mix time use hand fork thong make sure well coat breadcrumb mix,0,0,1,0,0
parboil green bean pot boil water boil 3 4 minut slightli tender bacon cook chop cook skillet avocado oil,0,0,1,0,0
place well clean beet saucepan 3 cup water bring roll boil medium high heat reduc heat light boil cook 25 minut beet fork tender remov cook beet water set asid cool throw beet water set asid cool onc beet fulli cool remov skin cut slice wedg set asid,1,0,1,0,0
cover potato salt water boil till tender drain mash stir soften butter sour cream chive season salt pepper butter lightli flour 9 1 2 deep pie plate spread mash potato arrang 6 oz mozzarella chees potato top tomato sprinkl basil oregano top remain mozzerella chees parmesan chees melt butter bake 425 25 30 minut chees melt cool slightli befor cut,1,0,0,0,0
posit rack middl oven preheat 350 degre butter 9 inch 10 inch diamet springform pan line bottom round parchment paper butter parchment dust flour tap excess arrang berri singl layer bottom pan sprinkl evenli 1 4 cup sugar sift 2 1 3 cup cake flour bake powder salt bake soda medium bowl set asid use electr mixer beat 3 4 cup butter remain 1 1 3 cup sugar larg bowl medium high speed occasion scrape side bowl pale fluffi 2 minut add egg one time beat well addit beat vanilla zest reduc speed low beat flour mixtur 3 addit altern buttermilk 2 addit begin end flour mixtur beat incorpor pour batter berri pan smooth top bake cake golden brown tester insert center come clean 1 hour 25 minut let cool pan set wire rack 15 minut run thin sharp knife around edg pan loosen remov pan side invert cake onto rack remov pan bottom peel parchment dust top gener powder sugar let cool complet,0,1,0,0,0
fri onion garlic larg pot add splash water prevent burn add rice water bring boil cut sweet potato small cube add pot cook 30 minut rice done water ha absorb option steam kale 5 minut season risotto salt pepper squeez lemon lime juic serv,1,1,0,0,0
preheat oven 375 degre,0,0,0,1,0
1 whiz raspberri liquidis food processor complet smooth siev bowl get rid hard pip stir sugar lemon juic 150ml 1 4 pint water,0,0,0,1,0
begin heat goat milk slowli temperatur reach 160ºf onc thi achiev take pot heat add lemon juic onc curd form whey clearli distinct curd yellowish color gentli pour curd along whey cheesecloth cover coland allow drain pull end togeth tie twine hang faucet allow whey drip sink hang 1 hour order retain moistur want spreadabl chèvre preheat oven 400ºf larg oven proof bowl add tart ingredi except flour place oven 10 minut take care bowl veri hot add flour immedi mix ball place onto tart pan use utensil choic begin spread dough along pan onc dough warm enough touch use finger palm even dough look like pictur bake 15 minut enough time edg brown larg mix bowl add chèvre along ingredi list garlic salt fresh ground black pepper mix well spread tart shell add slice cherri tomato meticul,1,1,0,1,0
1 saut onion drip tender 2 beat egg bowl add milk ham corn parsley season 3 stir onion 4 pour mixtur butter 1 quart casserol,0,1,0,0,0
direct,0,0,0,1,0
heat 2 tbsp oil add prawn stir fri chang color,1,0,0,1,0
combin dri ingredi bowl mix set asid,1,0,0,0,0
follow recip blog www cremedelacrumb blogspot com,0,1,0,0,0
cake preheat oven 350f butter 9 inch cake pan bowl sift togeth flour bake powder salt whisk togeth cream butter 3 4 cup sugar mixer heavi wooden spoon whisk egg yolk milk vanilla extract mixtur smooth whisk flour mixtur 1 2 cup time overwork beat egg white cream tartar 2 minut soft peak add remain 3 tbsp sugar beat medium peak whisk one forth egg mixtur butter mixtur lighten fold rest egg white mixtur rubber spatula spread batter cake pan bake 40 50 minut toothpick insert center come clean let cool 5 minut cake pan transfer cool rack cool complet cake room temperatur insert 4 toothpick 4 side cake mark middl long bread knife cut cake 2 halv lengthwis along toothpick syrup mix sugar water brandi thoroughli sugar dissolv place fridg cake readi assembl coffe mouss readi use pastri brush spread syrup 2 halv let soak 3 5 minut befor ad mouss,0,1,0,0,0
combin flour bake powder set asid melt butter larg saucepan remov heat blend sugar beat egg vanilla stir flour mixtur spread batter greas 13 x 9 x 2 inch 3 5 l cake pan,0,1,0,0,0
spiral zucchini set asid,1,0,1,0,0
pre heat oven 170ºc 325f ga 3 put kettl boil skin pheasant remov meat chop fairli small piec place bowl,0,0,1,0,0
make small hole egg knife pour egg white egg yolk bowl add ingredi season mix well refil egg shell 3 5 full prepar mixtur rememb overfil otherwis crown steam steam rest mixtur small bowl could tri save extra egg shell thi steam egg mixtur shall enough 5 egg shell,0,0,0,1,0
combin tomato content packag medium saucepan heat boil reduc heat simmer 5 minut cool room temperatur 30 minut befor serv refriger 3 week,0,1,0,0,0
start make dough ravioli add food processor ravioli ingredi,0,0,0,1,0
dough mix flour sooji salt oil togeth make smooth dough knead dough 4 5 min make smooth set dough asid cover plastic food wrap let dough sit 20 25 min fill boil potato pressur cooker 2 whistl let cool remov skin mash well,0,0,1,0,0
place tortellini pot boil water larg skillet cook bacon crispi remov bacon slot spoon place paper towel drain pour bacon greas except 1 tablespoon skillet place onion cook 2 minut golden pour cream reduc lightli thicken remov pasta water al dent 8 minut drain add pasta cream mixtur add bacon back pan along pea chees reduc 1 minut toss adjust season spoon larg pasta bowl serv garnish addit grate parmesan chees chop parsley desir,0,0,1,0,0
hot pan add tvp cook 1 2 minut add mix spice top make sure incorpor spice veri well tvp let cook 5 minut liquid ha evapor add lemon juic garlic oliv oil made smoothi textur magic bullet food processor stir mix veri well,0,1,0,1,0
one trick incred flavor thi risotto broth let start saucepan medium heat add 3 tbsp butter mushroom season salt pepper onc good amount moistur cook mushroom lightli brown add veget broth water chop parsley simmer 20 minut voila beauti mushroom broth onc broth ha cook 15 minut go ahead start risotto larg sauté pan rice plump quit bit medium low heat add 3 tbsp butter oil add onion garlic cook soften season salt pepper next add arborio rice toss coat well mixtur continu stir rice toast opaqu clear speck white center grain thi point fabul broth readi keep low heat use slot spoon add mushroom broth risotto mix combin add wine continu stir wine absorb next add coupl ladl broth rice continu stir absorb continu thi process rice complet cook risotto creami tast adjust season necessari salt pepper want overcook thi otherwis end veri sticki clumpi risotto end want see grain certainli add littl broth want looser consist pictur top finish sprinkl fresh chop parsley,1,1,0,1,0
food processor blender combin garlic oil tofu salt pepper process blend smooth transfer mixtur bowl cover refriger readi serv befor serv stir oliv caper serv bed lettuc whole grain cracker garnish lemon fresh herb choic,0,1,0,0,0
line 8x8 squar pan tin foil set asid add frost anim cracker cream chees food processor run high thing stop move scrape side bowl move cooki mixtur around spatula continu process high cooki cream chees smooth creami may take time stop scrap bowl set asid add white chocol candi melt microwav safe bowl microwav 30 second stir repeat microwav 30 second stir candi melt complet melt add half white chocol bottom tin foil line pan spread evenli offset spatula let harden speed process place fridg 15 minut ha set,0,0,1,0,0
place swirl oliv oil pre heat stock pot add onion saut transluc,0,0,0,1,0
combin flour salt confection sugar larg bowl use tip finger rub butter flour look mostli like wet sand make well middl pour egg gradual work egg flour moist dough form use heel hand distribut ani remain larg piec butter shape 5 inch disk cover plastic wrap refriger 1 hour thi done food processor roll dough 13 inch circl lay dough 11 inch tart pan remov bottom press side secur dough refriger one hour preheat oven 325 f dock bottom crust fork lay larg crumpl piec parchment top pour pie weight pound dri bean bake 25 minut crust light golden brown set asid increas temperatur 350 f mix togeth golden syrup molass lemon juic beat egg bowl add treacl mixtur final stir bread crumb pour mixtur prepar tart case,0,0,0,1,0
se tamizan junto lo ingredient seco se le agrega el huevo la pera rallada el aceit,0,0,1,0,0
preheat oven 350 f beat room temperatur egg heavi cream small bowl place pie crust deep dish glass pie plate crimp edg heat 2 tablespoon butter saut pan cook mushroom ond shallot brown season veget tast salt pepper stir chop chard leav cook onli long enough allow wilt cool mixtur sprinkl 2 ounc chees bottom pie crust spread veget top remain chees pour custard cream egg mixtur make sure chees veget cover wet custard mixtur,0,0,1,0,0
cook pasta al dent rins cold water cool stop cook process leav drain,1,0,1,0,0
preheat oven 350 degre spray 9x9 pan browni pop mold case cook spray stove medium low heat melt chocol butter medium pot mix egg vanilla sugar combin actual remov heat add egg would start cook befor could mix entir add flour mix well,0,0,1,0,0
preheat oven 400 line larg 9 inch pie plate roll pastri dough prick fork bake 10 minut remov oven reduc heat 350 small bowl combin sugar flour salt mix well spread evenli bottom crust warm cream microwav warm hot care pour warm cream sugar mixtur complet cover bit dab butter cream bake 350 f 45 minut hour golden spot form top fill seem liquid becom firmer cool,0,0,0,1,0
heat oven 350 degre f greas 2 loaf pan 9x5x3 mix flour bake soda salt bake powder cinnamon clove,0,1,0,0,0
prepar rice dash turmer dash ginger water cook heat larg fri pan griddl place chicken breast bowl add soy sauc teriyaki sauc line juic oyster sauc fish sauc toss drizzl littl oliv oil heat fri pan add chicken cook achiev beauti golden color tell chicken done firm meat drizzl littl oliv oil griddl place slice mushroom onion grill season mushroom onion dash salt black pepper place blanch broccoli heat griddl drizzl oliv oil season broccoli littl salt black pepper chicken cook place platter pan chicken wa cook drizzl littl oliv oil place tomato basil garlic add worcestershir sauc black pepper salt brown sugar sauté tomato soft garlic fragrant thi onli take minut two top onion mushroom chicken tomato sauc garnish plate grill broccoli serv rice,1,0,1,1,0
cook rice accord packag direct cool fluff fork,0,1,0,0,0
preheat oven 350 f beat room temperatur egg heavi cream small bowl place pie crust deep dish glass pie plate crimp edg heat 2 tablespoon butter saut pan cook mushroom ond shallot brown,0,0,1,0,0
preheat oven 200 degre c whisk togeth melt butter sugar add one egg time mix well batter turn fluffi mix togeth bowl flour bake powder ginger powder cinnamon,0,0,0,1,0
one trick incred flavor thi risotto broth let start saucepan medium heat add 3 tbsp butter mushroom season salt pepper onc good amount moistur cook mushroom lightli brown add veget broth water chop parsley simmer 20 minut voila beauti mushroom broth onc broth ha cook 15 minut go ahead start risotto larg sauté pan rice plump quit bit medium low heat add 3 tbsp butter oil add onion garlic cook soften season salt pepper next add arborio rice toss coat well mixtur continu stir rice toast opaqu clear speck white center grain thi point fabul broth readi keep low heat use slot spoon add mushroom broth risotto mix combin add wine continu stir wine absorb next add coupl ladl broth rice continu stir absorb continu thi process rice complet cook risotto creami tast adjust season necessari salt pepper want overcook thi otherwis end veri sticki clumpi risotto end want see grain certainli add littl broth want looser consist pictur top finish sprinkl fresh chop parsley grate chees would like mine serv sauté broccoli rabe,1,1,0,1,0
larg bowl combin flour 1 8 teaspoon salt yeast 1 2 cup water stir blend dough shaggi rough let dough rest warm place 72 degre doubl volum 3 hour turn dough onto lightli flour work surfac cover clean damp kitchen towel let stand doubl size 30 minut 1 hour place pizza stone use trusti chicago land cast iron pizza pan lowest rack oven preheat 550 degre 25 minut,0,1,0,1,0
wash sort pinto navi bean soak 8 hour overnight saut onion carrot garlic white wine place drain bean crockpot saute veget 6 cup water bouillon parsley liquid smoke cover cook least 8 hour sort rinc split pea lentil add pea lentil barley crockpot cover cook least 1 hour season tast 6 serv 219 4 calori 1 1 gram total fat sorri rememb wa sugest saute microwav want thank whoever report work beauti use techniqu thi recip,0,0,0,1,0
pre heat oven 375 degre f toss potato sweet potato ½ tablespoon oliv oil season salt pepper garlic powder chili powder put bake tray cook oven 15 minut stir everi 5 minut add zucchini mushroom mix anoth ½ tablespoon oliv oil mix well potato sweet potato roast anoth 5 10 minut make sure veggi nice caramel,0,1,0,0,0
pan pour two inch oil heat medium heat till hot cut chicken diagon thick strip two inch wide,0,1,0,0,0
